{
  "manifestSchemaVersion": 1,
  "importRequestId": "00000000-0000-4000-8000-000000000001",
  "packageId": "00000000-0000-4000-8000-000000000002",
  "workspaceId": "00000000-0000-4000-8000-000000000003",
  "sourceSystem": "fixture_source",
  "pipeline": {
    "runId": "fixture-run-a",
    "profileVersion": "fixture-profile-a"
  },
  "files": [
    {
      "fileKey": "source",
      "path": "source/document.docx",
      "sha256": "aaaaaaaaaaaaaaaaaaaaaaaaaaaaaaaaaaaaaaaaaaaaaaaaaaaaaaaaaaaaaaaa",
      "sizeBytes": 100,
      "mediaType": "application/vnd.openxmlformats-officedocument.wordprocessingml.document"
    }
  ],
  "sourceDocuments": [
    {
      "documentKey": "document-in-this-package",
      "fileKey": "source",
      "documentStableKey": "fixture-document-alpha"
    }
  ],
  "questions": [
    {
      "itemKey": "local-item-a",
      "identity": {
        "mode": "registered_stable",
        "stableQuestionKey": "fixture-persisted-record-alpha",
        "identityContractId": "fixture-persistent-record",
        "identityContractVersion": 1,
        "anchorEvidence": {
          "persistentRecordId": "fixture-persisted-record-alpha"
        }
      },
      "sourceDocumentKey": "document-in-this-package",
      "sourceEvidence": {
        "evidenceFileKeys": [
          "source"
        ],
        "sourceBlockRefs": [],
        "pageNumbers": []
      },
      "content": {
        "contentSchemaVersion": 1,
        "materialMarkdown": "",
        "stemMarkdown": "集合 $\\textcircled{1}$",
        "options": [
          {
            "label": "A",
            "markdown": "$x \\in A$"
          }
        ],
        "subquestions": [
          "（1）保留原文编号"
        ],
        "answerMarkdown": "A",
        "analysisMarkdown": "保留解析",
        "teachingNoteMarkdown": "",
        "media": [],
        "titleMarkdown": "原题标题"
      },
      "contentHash": null,
      "classificationSuggestions": {
        "subject": "数学",
        "stage": null,
        "grade": null,
        "questionType": null,
        "difficultyStars": null,
        "tags": []
      }
    }
  ]
}
